{
    "op": 0,
    "d": {
        "type": 0,
        "tts": false,
        "timestamp": "2018-03-26T11:49:46.616000+00:00",
        "pinned": false,
        "nonce": "427796301552287744",
        "mentions": [
            {
                "username": "<D0><BF><D0><B0><D0><BD><D0><B4><D0><B0>",
                "id": "270730226110038017",
                "discriminator": "2863",
                "avatar": "76bb64512f1ca00cdf9402934e35236c"
            }
        ],
        "mention_roles": [],
        "mention_everyone": false,
        "id": "427796302621835264",
        "embeds": [],
        "edited_timestamp": null,
        "content": "<@!270730226110038017> <:notsure:278508514652061710>",
        "channel_id": "269219052239585281",
        "author": {
            "username": "Punz",
            "id": "270791717190369283",
            "discriminator": "7187",
            "avatar": "01f3f46668c92c4ae51c405e4c1c984c"
        },
        "attachments": []
    },
    "s": 1,
    "t": "MESSAGE_CREATE"
}
