{
    "op": 0,
    "d": {
        "user": {
            "id": "268824010974822412"
        },
        "status": "idle",
        "roles": [
            "301043143292354570"
        ],
        "nick": "Макаронный Бог",
        "guild_id": "269209661973069825",
        "game": null
    },
    "s": 1,
    "t": "PRESENCE_UPDATE"
}
