{
    "op": 0,
    "d": {
        "user": {
            "id": "329121622701375489"
        },
        "status": "idle",
        "roles": [
            "270845668619190273"
        ],
        "nick": null,
        "guild_id": "269209661973069825",
        "game": null
    },
    "s": 1,
    "t": "PRESENCE_UPDATE"
}
