{
    "op": 0,
    "d": {
        "user": {
            "username": "shizzard",
            "id": "269144761103810561",
            "discriminator": "1337",
            "avatar": "b061d4cf67e160f93661f59bb95f6934"
        },
        "roles": [
            "269213289978920960",
            "269213127835516929",
            "269565043446644739",
            "270845668619190273",
            "301042304880345088",
            "301058554821869569",
            "332188255824904193",
            "403106989678264333",
            "277189846664085505",
            "335395823196045313",
            "387273646663532544"
        ],
        "nick": "Денис Тахарыч",
        "guild_id": "269209661973069825"
    },
    "s": 1337,
    "t": "GUILD_MEMBER_UPDATE"
}
